{
  "apiVersion": "alpha.platform.capability/v0.1",
  "kind": "CapabilityResponse",
  "metadata": {
    "callId": "call-email-send-0001",
    "operationId": "capop-email-send-0001",
    "runId": "run-send-approved-0001",
    "capabilityRef": "email-send"
  },
  "status": "pending-approval",
  "result": null,
  "pendingApproval": {
    "approvalRequestId": "apr-email-send-0001",
    "approvalMode": "always",
    "requestedScope": "operation",
    "expiresAt": "2026-09-17T12:00:00Z"
  },
  "error": null,
  "receipt": {
    "releaseResolutionDigest": "sha256:7070707070707070707070707070707070707070707070707070707070707070",
    "capabilityDefinitionDigest": "sha256:5e5e5e5e5e5e5e5e5e5e5e5e5e5e5e5e5e5e5e5e5e5e5e5e5e5e5e5e5e5e5e5e",
    "resultDigest": null,
    "providerBindingRef": null,
    "connectionBindingRef": "work-email",
    "policyDecisionId": "poldec-email-send-0001",
    "approvalDecisionIds": [],
    "idempotency": {
      "keyDigest": "sha256:7272727272727272727272727272727272727272727272727272727272727272",
      "replayed": false
    },
    "budget": {
      "reservationId": "budgetres-email-send-0001",
      "reserved": {
        "modelCalls": 0,
        "browserSeconds": 0,
        "capabilityCalls": 1,
        "costMicrousd": 10000
      },
      "charged": {
        "modelCalls": 0,
        "browserSeconds": 0,
        "capabilityCalls": 0,
        "costMicrousd": 0
      }
    },
    "evidenceRefs": [
      "evidence-email-summary-0001"
    ],
    "auditEventRefs": [
      "event-capability-requested-0001",
      "event-approval-requested-0001"
    ],
    "receivedAt": "2026-09-16T12:00:00Z",
    "completedAt": null,
    "authorizationDigest": "sha256:7171717171717171717171717171717171717171717171717171717171717171",
    "effectDigest": "sha256:7272727272727272727272727272727272727272727272727272727272727272",
    "executionMode": "durable",
    "providerExecution": null
  }
}
